[
  {
    "id": "D2-001",
    "domain": 2,
    "objective": "2.1",
    "type": "single",
    "difficulty": 1,
    "stem": "Un grupo de adolescentes descarga desde un foro un script de explotación ya hecho y lo usa para modificar la página principal de un sitio municipal. No dejan ningún mensaje político; solo publican capturas en redes sociales para presumir. ¿Qué tipo de actor de amenaza describe MEJOR este escenario?",
    "options": [
      "Organized crime",
      "Hacktivist",
      "Unskilled attacker",
      "Nation-state"
    ],
    "answer": [
      2
    ],
    "explanation": "Un unskilled attacker usa herramientas y exploits creados por otros, con poca sofisticación y recursos, a menudo por notoriedad. No hay motivación política (hacktivist), ni financiera estructurada (organized crime), ni los recursos y objetivos estratégicos de un nation-state."
  },
  {
    "id": "D2-002",
    "domain": 2,
    "objective": "2.1",
    "type": "single",
    "difficulty": 2,
    "stem": "Un contratista de defensa descubre que un atacante ha permanecido 14 meses dentro de su red usando exploits zero-day personalizados e infraestructura de comando y control dedicada. Solo se extrajeron planos de investigación de un nuevo sistema de radar; no hubo demanda de rescate. ¿Qué actor de amenaza es el MÁS probable?",
    "options": [
      "Hacktivist",
      "Insider threat",
      "Nation-state",
      "Organized crime"
    ],
    "answer": [
      2
    ],
    "explanation": "La larga permanencia (APT), los zero-days personalizados y el enfoque en propiedad intelectual militar indican un nation-state con gran financiamiento y motivación de espionaje. Organized crime buscaría ganancia financiera, un hacktivist publicitaría su causa y nada sugiere un insider."
  },
  {
    "id": "D2-003",
    "domain": 2,
    "objective": "2.1",
    "type": "single",
    "difficulty": 2,
    "stem": "Un hospital sufre el cifrado de sus servidores. La nota de rescate incluye un portal de \"atención al cliente\", un plazo de pago en criptomonedas y menciona un programa de afiliados que comparte las ganancias. ¿Qué actor de amenaza y motivación describen MEJOR este incidente?",
    "options": [
      "Hacktivist con motivación filosófica/política y de protesta",
      "Organized crime con motivación de ganancia financiera",
      "Nation-state con motivación de espionaje y de disrupción",
      "Unskilled attacker con motivación de caos"
    ],
    "answer": [
      1
    ],
    "explanation": "La estructura empresarial (Ransomware-as-a-Service, afiliados, soporte a víctimas) y la exigencia de pago son característicos del crimen organizado motivado por dinero. Un nation-state priorizaría el espionaje o la disrupción estratégica, un hacktivist una causa y un unskilled attacker no tendría esa organización."
  },
  {
    "id": "D2-004",
    "domain": 2,
    "objective": "2.1",
    "type": "single",
    "difficulty": 1,
    "stem": "El departamento de marketing contrata con una tarjeta corporativa un servicio SaaS para compartir archivos con agencias externas, sin informar ni pedir aprobación al área de TI. ¿Qué término describe MEJOR esta situación?",
    "options": [
      "Hacktivism",
      "Shadow IT",
      "Insider threat malicioso",
      "Supply chain attack"
    ],
    "answer": [
      1
    ],
    "explanation": "Shadow IT es el uso de tecnología o servicios sin la aprobación ni el control de TI, lo que crea superficies de ataque no gestionadas. No hay intención maliciosa (insider malicioso), ni compromiso de un proveedor (supply chain), ni motivación ideológica."
  },
  {
    "id": "D2-005",
    "domain": 2,
    "objective": "2.1",
    "type": "single",
    "difficulty": 2,
    "stem": "Tras ser excluido de una promoción, un administrador de bases de datos elimina en la madrugada los respaldos de producción. No intenta vender información ni pide nada a cambio; deja una nota diciendo que la empresa \"se lo merecía\". ¿Cuál es la motivación MÁS probable?",
    "options": [
      "Revenge",
      "Espionage",
      "Blackmail",
      "Financial gain"
    ],
    "answer": [
      0
    ],
    "explanation": "La acción responde a un agravio personal sin beneficio económico ni exigencias, lo que indica venganza (revenge). Blackmail implicaría una exigencia a cambio de no causar daño, financial gain una ganancia económica y espionage la obtención encubierta de información."
  },
  {
    "id": "D2-006",
    "domain": 2,
    "objective": "2.1",
    "type": "single",
    "difficulty": 3,
    "stem": "Un analista compara dos grupos externos con motivación política. El grupo A realiza ataques DDoS con herramientas públicas durante protestas. El grupo B desarrolla malware propio, compra zero-days y mantiene infraestructura durante años. ¿Qué atributo de los actores de amenaza explica MEJOR la diferencia entre ambos?",
    "options": [
      "Uso de shadow IT",
      "Ubicación interna o externa (internal/external)",
      "Recursos/financiamiento (resources/funding)",
      "Motivación filosófica/política"
    ],
    "answer": [
      2
    ],
    "explanation": "Ambos son externos y comparten motivación política; lo que los diferencia es el nivel de recursos y financiamiento, que habilita mayor sofisticación (zero-days, infraestructura persistente). Shadow IT no es un atributo de actores de amenaza externos."
  },
  {
    "id": "D2-007",
    "domain": 2,
    "objective": "2.1",
    "type": "multi",
    "difficulty": 1,
    "stem": "¿Qué características describen MEJOR a un hacktivist? (Elige DOS.)",
    "options": [
      "Siempre es un empleado interno de la organización atacada",
      "Está motivado por creencias filosóficas, políticas o sociales",
      "Su objetivo principal es la ganancia financiera mediante extorsión",
      "Opera principalmente como herramienta de TI no autorizada por la empresa",
      "Suele recurrir a defacement, DDoS o filtración de datos para dar visibilidad a su causa",
      "Normalmente dispone de más financiamiento que un nation-state"
    ],
    "answer": [
      1,
      4
    ],
    "explanation": "Los hacktivists actúan por causas ideológicas y buscan notoriedad con ataques visibles como defacement, DDoS o filtraciones. No suelen tener los recursos de un nation-state, la ganancia financiera es propia del crimen organizado, pueden ser externos y shadow IT es un concepto distinto."
  },
  {
    "id": "D2-008",
    "domain": 2,
    "objective": "2.1",
    "type": "match",
    "difficulty": 2,
    "stem": "Empareja cada escenario con la motivación del actor de amenaza que MEJOR lo describe.",
    "items": [
      "Un agente extranjero se infiltra para robar los diseños de un nuevo producto.",
      "Un colectivo filtra documentos internos para protestar contra la deforestación causada por una minera.",
      "Un grupo ataca la red eléctrica de un país adversario durante un conflicto armado.",
      "Un atacante obtiene fotos privadas de un ejecutivo y exige un pago para no publicarlas.",
      "Un actor borra datos al azar en varias empresas sin exigir nada, solo para provocar desorden.",
      "Un investigador encuentra una vulnerabilidad y la reporta al fabricante sin pedir pago."
    ],
    "choices": [
      "War",
      "Blackmail",
      "Espionage",
      "Disruption/chaos",
      "Philosophical/political",
      "Ethical"
    ],
    "answer": [
      2,
      4,
      0,
      1,
      3,
      5
    ],
    "explanation": "Atacar infraestructura en un conflicto es war; exigir pago a cambio de no publicar es blackmail; robar diseños de forma encubierta es espionage; dañar sin objetivo ni exigencia es disruption/chaos; filtrar por una causa es philosophical/political; reportar responsablemente sin beneficio es ethical."
  },
  {
    "id": "D2-009",
    "domain": 2,
    "objective": "2.2",
    "type": "single",
    "difficulty": 1,
    "stem": "Varios empleados reciben un mensaje de texto: \"Su paquete no pudo entregarse. Actualice su dirección en http://entregas-mx.co/r?id=8812\". ¿Qué tipo de ataque es este?",
    "options": [
      "Watering hole",
      "Vishing",
      "Pretexting",
      "Smishing"
    ],
    "answer": [
      3
    ],
    "explanation": "Smishing es phishing a través de SMS. Vishing usa llamadas de voz, pretexting es la construcción de una historia falsa (puede acompañar a cualquier vector) y watering hole compromete un sitio que las víctimas visitan habitualmente."
  },
  {
    "id": "D2-010",
    "domain": 2,
    "objective": "2.2",
    "type": "single",
    "difficulty": 2,
    "stem": "El director financiero recibe un correo desde la cuenta legítima del CEO, que fue comprometida días antes. El mensaje pide transferir con urgencia USD 85,000 a la \"nueva cuenta bancaria\" de un proveedor conocido y solicita discreción. ¿Qué tipo de ataque es el MÁS probable?",
    "options": [
      "Brand impersonation",
      "Typosquatting",
      "Business email compromise (BEC)",
      "Watering hole"
    ],
    "answer": [
      2
    ],
    "explanation": "BEC usa cuentas de correo empresariales comprometidas o suplantadas para engañar a empleados y obtener transferencias o datos. Aquí no hay un dominio mal escrito (typosquatting), ni suplantación de una marca ante clientes, ni compromiso de un sitio web frecuentado."
  },
  {
    "id": "D2-011",
    "domain": 2,
    "objective": "2.2",
    "type": "single",
    "difficulty": 2,
    "stem": "Un atacante quiere comprometer a ingenieros de varias empresas de energía. En lugar de atacarlas directamente, inyecta un exploit en un foro técnico especializado que esos ingenieros visitan a diario. ¿Qué técnica está utilizando?",
    "options": [
      "Business email compromise",
      "Watering hole",
      "Typosquatting",
      "Pretexting"
    ],
    "answer": [
      1
    ],